{
  "envelope_version": "0.2",
  "machine": {
    "id": "golden-synthetic-arm",
    "class": "arm",
    "description": "TEST-ONLY synthetic machine"
  },
  "frame": "base_link",
  "points": [
    {
      "id": "tool",
      "description": "TEST-ONLY synthetic tool point",
      "max_speed_mps": 0.25
    }
  ],
  "workspace": {
    "zones": [
      {
        "id": "tool_box",
        "kind": "keep_in",
        "applies_to": [
          "tool"
        ],
        "box": {
          "min_m": [
            0.2,
            -0.15,
            0.05
          ],
          "max_m": [
            0.4,
            0.15,
            0.3
          ]
        }
      },
      {
        "id": "fixture",
        "kind": "keep_out",
        "applies_to": [
          "*"
        ],
        "box": {
          "min_m": [
            0.34,
            0.1,
            0.05
          ],
          "max_m": [
            0.4,
            0.15,
            0.12
          ]
        }
      }
    ]
  },
  "motion": {
    "max_speed_mps": 0.3
  },
  "stop": {
    "category": 1,
    "max_time_ms": 300,
    "max_distance_m": 0.05
  },
  "heartbeat": {
    "model_timeout_ms": 500,
    "gate_timeout_ms": 200,
    "on_loss": "stop"
  },
  "signature": [
    {
      "alg": "Ed25519",
      "kid": "TEST-ONLY-not-an-integrator-key",
      "sig": "AAAA-TEST-ONLY-not-a-signature"
    }
  ]
}
