{
  "envelope_version": "0.2",
  "machine": {
    "id": "mm-1",
    "class": "mobile_manipulator",
    "mass_kg": 40
  },
  "frame": "map",
  "points": [
    {
      "id": "base",
      "description": "Centre of the base footprint, at floor level.",
      "max_speed_mps": 0.5
    },
    {
      "id": "tool",
      "description": "Centre of the gripper fingertips, closed.",
      "link": "gripper"
    }
  ],
  "workspace": {
    "zones": [
      {
        "id": "room",
        "kind": "keep_in",
        "applies_to": [
          "*"
        ],
        "prism": {
          "polygon_m": [
            [
              0,
              0
            ],
            [
              6,
              0
            ],
            [
              6,
              4
            ],
            [
              0,
              4
            ]
          ],
          "z_m": [
            -0.05,
            2.5
          ]
        }
      },
      {
        "id": "pillar",
        "kind": "keep_out",
        "applies_to": [
          "*"
        ],
        "prism": {
          "polygon_m": [
            [
              2,
              1
            ],
            [
              3,
              1
            ],
            [
              3,
              2
            ],
            [
              2,
              2
            ]
          ]
        }
      },
      {
        "id": "shelf",
        "kind": "keep_out",
        "applies_to": [
          "tool"
        ],
        "box": {
          "min_m": [
            5.0,
            3.0,
            0.8
          ],
          "max_m": [
            6.0,
            4.0,
            1.2
          ]
        }
      }
    ]
  },
  "motion": {
    "max_speed_mps": 0.25,
    "max_turn_radps": 1.0
  },
  "proximity": [
    {
      "when": {
        "human_within_m": 1.5
      },
      "max_speed_mps": 0.2
    },
    {
      "when": {
        "human_within_m": 0.5
      },
      "action": "stop"
    }
  ],
  "stop": {
    "category": 1,
    "max_time_ms": 300,
    "max_distance_m": 0.15,
    "sources": [
      {
        "source": "stop_message",
        "category": 1,
        "max_time_ms": 300,
        "max_distance_m": 0.15
      },
      {
        "source": "comms_loss",
        "category": 1,
        "max_time_ms": 250,
        "max_distance_m": 0.12
      }
    ]
  },
  "heartbeat": {
    "model_timeout_ms": 200,
    "gate_timeout_ms": 50,
    "on_loss": "stop"
  },
  "signature": [
    {
      "alg": "Ed25519",
      "kid": "NOT-A-REAL-KEY-ID_placeholder-for-a-test-v",
      "sig": "NOT-A-REAL-SIGNATURE_syntactically-valid-base64url-placeholder-for-a-test-vector-only"
    }
  ]
}
