{
  "envelope_version": "0.2",
  "machine": {
    "id": "loophole-search",
    "class": "arm",
    "description": "TEST-ONLY synthetic envelope"
  },
  "frame": "base_link",
  "points": [
    {
      "id": "tool",
      "description": "TEST-ONLY tool point",
      "max_speed_mps": 0.237
    },
    {
      "id": "elbow",
      "description": "TEST-ONLY elbow point"
    },
    {
      "id": "camera_mast",
      "description": "TEST-ONLY point with no zone",
      "max_speed_mps": 0.1742
    }
  ],
  "workspace": {
    "zones": [
      {
        "id": "tool_region",
        "kind": "keep_in",
        "applies_to": [
          "tool"
        ],
        "box": {
          "min_m": [
            -0.1256,
            0.1851,
            0.2096
          ],
          "max_m": [
            0.2321,
            0.5611,
            0.4808
          ]
        }
      },
      {
        "id": "cell",
        "kind": "keep_in",
        "applies_to": [
          "elbow"
        ],
        "box": {
          "min_m": [
            -0.6256,
            -0.3149,
            -0.2904
          ],
          "max_m": [
            0.7321,
            1.0611,
            0.9808
          ]
        }
      },
      {
        "id": "fixture",
        "kind": "keep_out",
        "applies_to": [
          "tool",
          "elbow"
        ],
        "box": {
          "min_m": [
            -0.0144,
            0.2803,
            0.3352
          ],
          "max_m": [
            0.123,
            0.4092,
            0.4245
          ]
        }
      }
    ]
  },
  "motion": {
    "max_speed_mps": 0.5859,
    "max_joint_speed_radps": 2.0,
    "joints": [
      {
        "name": "shoulder",
        "position_rad": [
          -1.5,
          1.5
        ],
        "max_speed_radps": 1.5
      },
      {
        "name": "elbow",
        "position_rad": [
          -2.0,
          2.0
        ],
        "max_speed_radps": 2.0
      }
    ]
  },
  "stop": {
    "category": 1,
    "max_time_ms": 300,
    "max_distance_m": 0.0149,
    "sources": [
      {
        "source": "stop_message",
        "category": 1,
        "max_time_ms": 300,
        "max_distance_m": 0.0149
      },
      {
        "source": "hardwired_stop",
        "category": 1,
        "max_time_ms": 300,
        "max_distance_m": 0.0149
      },
      {
        "source": "heartbeat_loss",
        "category": 1,
        "max_time_ms": 300,
        "max_distance_m": 0.0149
      },
      {
        "source": "comms_loss",
        "category": 1,
        "max_time_ms": 300,
        "max_distance_m": 0.0149
      },
      {
        "source": "power_loss",
        "category": 1,
        "max_time_ms": 300,
        "max_distance_m": 0.0149
      },
      {
        "source": "gate_loss",
        "category": 1,
        "max_time_ms": 300,
        "max_distance_m": 0.0149
      }
    ]
  },
  "heartbeat": {
    "model_timeout_ms": 500,
    "gate_timeout_ms": 200,
    "on_loss": "stop"
  },
  "proximity": [
    {
      "when": {
        "human_within_m": 1.7759
      },
      "max_speed_mps": 0.2929
    },
    {
      "when": {
        "human_within_m": 0.3937
      },
      "action": "stop"
    }
  ]
}
